date,type,topic,title,url,text
6/4/2025,Article,News,South Korea's new president has a Trump-shaped crisis to avert,https://www.bbc.com/news/articles/cpvkxxerln1o,"South Korea's new president, Lee Jae-myung, has secured a storming victory, but his honeymoon will barely last the day. The former opposition leader is not getting to enjoy the two-month transition period usually afforded to new leaders, so they can build their team and nail down their vision for the country.  Instead he is entering office immediately, to fill the hole left by the impeachment of the former president, Yoon Suk Yeol, who last December tried and failed to bring the country under martial law. In electing Lee, with almost 50% of the vote , South Koreans have vehemently rejected the military dictatorship that was almost forced upon them. Lee campaigned on the promise that he would strengthen South Korea's democracy and unite the country, after a divisive and tumultuous six months. But that will have to wait. First, he has a Donald Trump shaped crisis to avert. In the coming months, Trump has the power to destabilise South Korea's economy, its security, and its volatile relationship with North Korea. South Koreans were dismayed when Trump slapped 25% tariffs on all Korean imports in April, after already hitting the country with aggressive tariffs on its core industries – steel and cars. They had assumed that being longstanding military allies from the days of the Korean War, and having a free-trade agreement with the US, would spare them. If these tariffs take effect ""they could trigger an economic crisis"", a seasoned advisor to Lee's Democratic Party, Moon Chung-in, said.  Before Trump's announcements, South Korea's economy was already slowing down. The martial law chaos constricted it further. Then, in the first quarter of this year, it contracted. Fixing this has been voters' number one demand, even above fixing their beleaguered democracy. But without a president, talks with Trump have been on hold. They cannot be put off any longer. And there is much more than South Korea's economy at stake in these negotiations. The US currently guarantees South Korea's security by promising to come to its defence with both conventional and nuclear weapons were it to be attacked by its nuclear-armed neighbour, North Korea. As part of this deal there are 28,500 US troops stationed in the South. Yet Trump has made clear he does not plan to differentiate between trade and security when negotiating with the country, signalling that Seoul is not pulling its weight in either area. In a post on his Truth Social platform in April, Trump said that during initial tariff talks with South Korea he had ""discussed payment for the big time military protection we provide"", calling it ""beautiful and efficient one-stop shopping"". This approach makes Seoul uniquely vulnerable.  Evans Revere, a former senior US diplomat based in Seoul, fears a crisis is coming. ""For the first time in our lifetime we have a US president who does not feel a moral and strategic obligation towards Korea"". In his first term as president, Trump questioned the value of having US forces stationed in Korea and threatened to withdraw them unless Seoul paid more to have them. It seems likely he will demand more money this time around. Seoul may not want to pay more, but it can afford to. A bigger problem is that Trump's calculations, and that of his defence department, seem to have changed. This is no longer just about the money. Washington's top priority now in Asia is not just stopping North Korea attacking the South, it is also to contain China's military ambitions in the region and against Taiwan. Last year, a now-senior US defence official, Elbridge Colby, said that South Korea was going to have to take ""overwhelming responsibility for its own self-defence against North Korea"", so the US could be ready to fight China. One option is that the troops stationed here would switch their focus to constraining China. Another, touted by a couple of US defence officials last month, is that thousands of soldiers would be removed from the peninsula altogether and redeployed, and that Seoul's military would also have to play a role in deterring Beijing. Not only could this put South Korea in a dangerous military predicament, but it would also create a diplomatically difficult one. President Lee, who historically has been sceptical of Korea's alliance with the US, wants to use his presidency to improve relations with China, South Korea's powerful neighbour and trading partner. He has stated several times that South Korea should stay out of a conflict between China and Taiwan. ""We must keep our distance from a China-Taiwan contingency. We can get along with both"", he said during a televised debate last month. The political advisor Mr Moon, who once served as national security advisor, reiterated Lee's concerns. ""We are worried about America abandoning us, but at the same time we are worried about being entrapped in American strategy to contain and encircle China"", he said. ""If the US threatens us, we can let [the forces] go"", he said. For Mr Revere, the former US diplomat, this combination of Lee, Trump and China threatens to create ""the perfect storm"". ""The two leaders may find themselves on very different pages and that could be a recipe for a problematic relationship. If this plays out, it would undermine peace and stability in North East Asia"". In Pyongyang, Kim Jong Un will no doubt be watching closely, keen to exploit the shifting ground. His nuclear weapons programme is more dangerous than ever, and nothing or no-one has been able to convince him to wind it down - including Donald Trump who, during his first term, was the first US president to ever meet a North Korean leader. Since returning to office Trump has indicated he would like to resume talks with Kim, which ended without agreement in 2019. In Seoul, there is real concern that this time the pair could strike a deal that is very bad for South Korea. The fear is that Trump would take an ""America first"" approach, and ask Kim to stop producing his intercontinental ballistic missiles that threaten the US mainland, without addressing the multiple short-range nuclear weapons pointed at Seoul. And in return, Kim could demand a high price. Kim has far more leverage than he did in 2019. He has more nuclear warheads, his weapons are more advanced, and the sanctions that were supposed to put pressure on his regime have all but collapsed, thanks largely to Vladimir Putin. The Russian leader is providing Kim with economic and military support in return for North Korea's help fighting the war in Ukraine. This therefore gives Kim the cover to make more audacious requests of the US. He could ask Trump to accept North Korea as a nuclear weapons state, and agree to a deal that would reduce Pyongyang's weapons count rather than get rid of them altogether. Another of his requests could likely be for the US to remove some of the security it provides South Korea, including the troops. ""North Korea is in the driver's seat now. The only curveball is how much risk President Trump will take"", said Sydney Seiler, who was involved in the 2019 negotiations on the US side. ""The idea there might be some sort of troop withdrawal [included in a deal] is really not that far-fetched"". Mr Seiler stressed that the US would ""not leave South Korea in the dust,"" but advised South Korea's new president to ""establish a relationship with Trump early on"", and be clear they expect to be part of any process, if talks materialise. The new president must move quickly on all fronts, added Mr Revere, arguing that Lee's first homework assignment should be to come up with a list of 10 reasons why South Korea is an indispensable partner and why American dollars are being well spent; reasons that can convince a sceptical and transactional Trump. One Ace card South Korea is hoping to play is its shipbuilding prowess. It builds more vessels than any other country bar China, which is now the world's dominant ship builder and home to the largest naval fleet. This is a frightening prospect for the US whose own industry and navy are in decline. Last month I visited South Korea's flagship shipyard in Ulsan on the south coast - the largest in the world – where Hyundai Heavy Industries builds 40-50 new ships a year, including naval destroyers. Sturdy cranes slotted together sheets of metal, creating vessels the size of small villages. Seoul is hoping it can use this expertise to build, repair and maintain warships for the US, and in the process convince Washington it is a valuable partner. ""US shipbuilding difficulties are affecting their national security"", said Jeong Woo Maan, head of strategy for Hyundai's naval and ship unit. ""This is one of the strongest cards we have to negotiate with"". In his campaign for president, Lee Jae-myung declared he did not want to rush into any agreements with Trump. Now in office, he could quickly find himself without this luxury.  Copyright 2025 BBC. All rights reserved.  The BBC is not responsible for the content of external sites. Read about our approach to external linking.  "
6/4/2025,Article,News,Deadly mushroom lunch cook tells court she threw up toxic meal,https://www.bbc.com/news/articles/c5yx7vewn75o,"An Australian woman on trial for murder says she threw up the toxic mushroom meal which killed her relatives, after binge eating dessert. Erin Patterson has pleaded not guilty to four charges - three of murder and one of attempted murder - over the beef Wellington lunch at her regional Victorian house in July 2023. Prosecutors allege Ms Patterson deliberately served toxic death cap mushrooms, but only to her guests. Her defence team say the contaminated meal was a tragic accident, and argue it had made their client sick too. Ms Patterson told the court she had only eaten a small part of lunch but later consumed two-thirds of a cake, before becoming ""over-full"" and vomiting. Doctors have previously told the trial Ms Patterson did not have the same intense symptoms as the other people who'd eaten at her house. On her third day of wide-ranging testimony, Ms Patterson also admitted she had lied about a cancer diagnosis - which prosecutors say she used to coax the guests to her house - instead of revealing she was actually planning to undergo weight-loss surgery. She said she had dumped a food dehydrator and wiped her phone in the days after the incident out of fear of being blamed for her relative's deaths, telling the court her estranged husband had accused her of poisoning them. Three people died in hospital in the days after the meal, including Ms Patterson's former in-laws, Don Patterson, 70, and Gail Patterson, 70, as well as Gail's sister, Heather Wilkinson, 66. A single lunch guest survived, 71-year-old local pastor Ian Wilkinson, after weeks of treatment in hospital. The Victorian Supreme Court trial - which started almost six weeks ago - has heard from more than 50 witnesses, and attracted huge global attention. In the Morwell courthouse, Ms Patterson gave a detailed account of the fatal lunch, saying she had invited her guests under the premise she wanted to talk about health issues.  The 14-member jury heard that Ms Patterson went through ""quite a long process of trying to decide what to cook"" for the lunch before choosing to make beef Wellington. The dish - usually prepared with a long strip of fillet steak, wrapped in pastry and mushrooms - was something Ms Patterson's mother made when she was a child, to mark special occasions, she said. After deciding the mushrooms she'd prepared tasted ""bland"", she said she'd added some dried ones - bought from an Asian grocer in Melbourne months earlier - from a container in her pantry.  Asked if that container may have had other types of mushrooms in it, Ms Patterson, choking up, said: ""Now I think there was a possibility that there were foraged ones in there as well."" Yesterday, the court heard that Ms Patterson had started hunting for mushrooms in locations close to her Leongatha home in 2020, and her long-standing love for fungi had expanded to include wild varieties as they had ""more flavour"".  Ms Patterson told the jury she had served up the food when it was ready, and instructed her guests to grab a plate themselves as she finished preparing gravy. There were no assigned seats or plates, she said. Mr Wilkinson previously told the trial the guests had each been given grey plates while Ms Patterson had eaten off an orange one. Ms Patterson on Wednesday said she didn't have any grey plates. During the lunch, Ms Patterson recalled that she didn't eat much of her food - ""a quarter, a third, somewhere around there"" - because she was busy talking.  She conceded she had told her guests she had cancer, but in court explained she told this lie to make sure she had help with childcare when she underwent gastric bypass surgery. ""I remember thinking I didn't want to tell anybody what I was going to have done. I was really embarrassed by it,"" she said. After the guests left, she cleaned up the kitchen and ate a slice of orange cake Gail had brought. ""[I ate] another piece of cake, and then another piece,"" she said, before finishing the rest of the dessert. ""I felt sick… over-full so I went to the toilets and brought it back up again."" ""After I'd done that, I felt better."" Yesterday, the court heard that Ms Patterson had secretly struggled with bulimia since her teens and was prone to regularly binge eating and vomiting after meals.  Ms Patterson told the court that she started to develop gastro-like symptoms hours after the lunch and took herself to hospital to ""get some fluids"" two days later. She was ""shocked but confused"" when medical staff asked if she could have eaten death cap mushrooms. While in hospital for observation overnight, Ms Patterson said her former husband Simon asked her about a dehydrator she owned. ""Is that how you poisoned my parents?"" she told the trial he'd said to her - something Mr Patterson denies.  After this encounter, she'd been ""frantic"", Ms Patterson said, and upon being sent home had disposed of her food dehydrator at the local tip. ""I had made the meal and served it and people had got sick."" ""I was scared that they would blame me for it."" The court also heard that Ms Patterson erased the data on one of her phones several times - including while police were searching her house - because she did not want detectives to see her photos of mushrooms and the dehydrator. Ms Patterson will continue giving evidence on Thursday, before prosecutors will have the opportunity to cross-examine her.  Copyright 2025 BBC. All rights reserved.  The BBC is not responsible for the content of external sites. Read about our approach to external linking.  "
6/4/2025,Article,News,The Indian pilot set for a historic space journey on Axiom-4,https://www.bbc.com/news/articles/ce80glkl7nno,"The Axiom Mission 4 (Ax-4), set to take off from Nasa's Kennedy Space Center in Florida next week, will be piloted by an Indian as it soars towards the International Space Station (ISS). Group Captain Shubhanshu Shukla of the Indian air force is among the four-member multi-country crew of Ax-4 that will be spending two weeks on the ISS. The flight, scheduled for 10 June at 08:22 EDT (12:22GMT; 17:52IST), has generated a huge interest in India as Group Captain Shukla will only be the second Indian ever to travel to space and the first to visit the ISS. The trip comes 41 years after cosmonaut Rakesh Sharma became the first Indian to fly to space aboard a Russian Soyuz in 1984. He spent nearly eight days there. Ax-4 is led by former Nasa astronaut Peggy Whitson - a space veteran who has been commander of ISS twice, spent hundreds of days in space and done 10 space walks.  The team also includes Slawosz Uznanski-Wisniewski from Poland and Tibor Kapu from Hungary - just like the Indian astronaut, they will also be taking their countries back to space after more than four decades.  Experts say the pilot's role is key, as he would serve as second-in-command to the mission commander, assisting with spacecraft operations during launch, docking, undocking and return to Earth. The astronauts, who have been in quarantine since 25 May to prepare for the trip, addressed a press conference on Tuesday night where they showed-off Joy - a small, white toy swan they said would be ""the fifth crew member"" on Ax-4. ""We are good for the launch, we have completed all the training and the team has bonded well,"" Commander Whitson said. Describing the past year as ""nothing short of transformative"" for him, Group Captain Shukla said he did not have words to describe his excitement. ""It has been an amazing journey so far, but the best is yet to come,"" he said.  ""As I go into space, I carry not just instruments and equipment, I carry hopes and dreams of a billion hearts. ""I request all Indians to pray for the success of our mission,"" he added. The 39-year-old was among four Indian air force officers shortlisted last year to travel on the country's first-ever human space flight, scheduled for 2027. The Gaganyaan mission aims to send three astronauts to an orbit of 400km and bring them back after three days. India has also announced ambitious plans to set up a space station by 2035 and send an astronaut to the Moon by 2040. India's space agency Isro has been carrying out a number of tests to prepare for Gaganyaan. In December, it plans to send a female humanoid robot to space as part of the tests. So, officials say the mission comes as a ""unique exciting opportunity"" for Isro and has generated a lot of interest in India. The trip to ISS aboard Ax-4 - a commercial flight operated by Houston-based private company Axiom Space - is a collaborative effort between Nasa, Isro and European Space Agency (Esa). Tuesday's flight will be launched using the SpaceX Crew Dragon capsule on a Falcon 9 rocket.  Isro, which has paid 5bn rupees ($59m; £43m) to secure a seat for Group Captain Shukla and his training, says the experience he will gain during his trip to the ISS will help India immensely. ""The benefit we will get from this mission is phenomenal in terms of the training, exposure to the facilities and the experience of jointly conducting experiments in space,"" Isro Chairman V Narayanan recently said. Sudeesh Balan, Isro project director, said Group Captain Shukla had been training since August last year.  ""He's undergone rigorous training, including physical and psychological assessments, to prepare for the journey."" Born on 10 October 1985 in the northern city of Lucknow, Group Captain Shukla joined the Indian air force as a fighter pilot in 2006.  According to Axiom Space, he has over 2,000 hours of flying experience and has flown MiGs, Sukhois, Dorniers, Jaguars and Hawks. His sister Shuchi Mishra, however, told the BBC that his entry into the air force was ""accidental"". ""When he was 17 and in high school, his friend got a form to apply to the National Defence Academy. But this friend was slightly overage so he was not qualified. Not wanting to waste the form, Shubhanshu filled it up,"" Ms Mishra said. ""He was selected - and has never looked back."" Ms Mishra says their family ""is thrilled as one of ours has been chosen out of India's 1.4 billion people"" for this mission. ""We all feel so privileged and proud that he's a part of our family and that we've been a part of his journey."" Her brother, she says, is undertaking this journey for his country - for the next generation. ""He always tells people to dream big, to do something for the nation. We are hoping that his trip will inspire the next generation."" Besides piloting the mission, the Indian astronaut will have a busy schedule during his time on ISS. Considering the huge interest in the flight, Isro has said they are organising events for him to interact with Indian students and answer their questions while floating in space. ""We believe it will motivate our young minds to become passionate about space tech,"" Mr Balan said. But most of the time, the four-member crew will be conducting 60 scientific experiments, seven of which come from India.  Former Nasa scientist Mila Mitra says Isro's experiments will help improve our understanding of space and its effects on biology and micro-gravity. One of the key experiments, she explains, will investigate the impact of spaceflight on six varieties of crop seeds.  ""This project aims to help understand how crops may be grown in space for future exploration missions. After the mission, seeds will be grown for multiple generations and plants showing preferred traits will be selected for genetic analyses."" Another Isro experiment involves growing three strains of microalgae which could be used as food, fuel or even in life support systems and this will help identify the most suitable ones for growing in microgravity, she says. The Isro projects would also investigate how tardigrades - micro-animals on Earth that can survive extreme environments - would fare in space.  ""The project will examine the revival of dormant tardigrades, count the number of eggs laid and hatched during a mission, and compare space-flown versus ground control populations,"" Ms Mitra says. The other experiments aim to identify how muscle loss occurs in space and how it can be treated; and the physical and cognitive impact of using computer screens in microgravity.  ""The research will study how gaze fixation and rapid eye movements are affected by being in space, and how this may affect an astronaut's stress and wellbeing. The results could influence future spacecraft computer design and interaction,"" she says. Follow BBC News India on Instagram, YouTube, X and Facebook. Copyright 2025 BBC. All rights reserved.  The BBC is not responsible for the content of external sites. Read about our approach to external linking.  "
6/4/2025,Article,News,"Teen TikTok star shot dead after man broke into her home, police say",https://www.bbc.com/news/articles/c4g7v1evrmdo,"A 22-year-old man has been arrested in Pakistan and confessed to the murder of 17-year-old social media influencer Sana Yousaf, according to police.  Authorities say they believe Umar Hayat murdered Ms Yousaf at her home in Islamabad on Monday after she rejected what they called his ""offers of friendship"". He allegedly also repeatedly tried, and failed, to meet her.  They say he broke into her home, fired two shots, stole her phone and fled.  Ms Yousaf's father, Syed Yousaf Hassan, told the BBC she was his only daughter, and was ""very brave"". Her family have gathered in Chitral, where Ms Yousaf has been buried. Mr Yousaf said she had never mentioned Hayat, nor any threatening behaviour, before she was killed.  He said Ms Yousaf's aunt was at the family home when the suspect broke in, and that he had also threatened to shoot her before fleeing.  Ms Yousaf died before she could be taken to the hospital. Police said the ""brutal"" murder caused ""a wave of concern"" across the country, and that there was ""immense"" pressure to find the killer.  They raided locations across the capital and the province of Punjab and scanned footage from 113 CCTV cameras.  The suspected murder weapon and Ms Yousaf's phone have since been recovered. Ms Yousaf already had a wide following in Pakistan, with half a million fans on Instagram before her death. Condolences have flooded her social media pages.  Her TikTok account gained hundreds of thousands of followers overnight, and now stands at more than a million. Her last video on Instagram, posted last week, showed her surrounded by balloons and cutting a cake for her birthday. Given her high profile in Pakistan, news of Ms Yousaf's death spread quickly in local news media and on social media platforms. It's also ignited a fierce debate about women on social media. While many have shared their outrage at news of Ms Yousaf's death, there has also been backlash towards her work as an influencer. Digital rights advocacy group Bolo Bhi has been monitoring the online reaction, and its director Usama Khilji said such criticism had been coming from a small portion of mostly male internet users - some of whom have cited religious grounds.  ""They're asking why she was putting up all this content, and even suggesting the family should take down her Instagram and TikTok accounts because they add to her 'sins',"" Mr Khilji explained. Dr Farzana Bari, a prominent human rights activist, argued the reaction is ""misogynistic"" and ""patriarchal"". She said Ms Yousaf had ""her own voice"", and that the discourse online is a reminder that social media has become a ""very threatening place for female content creators"" in Pakistan. The Inspector General of Police for Islamabad, Syed Ali Nasir Rizvi, said women who choose to become social media influencers ""deserve our encouragement and support"". He added Ms Yousaf's murder was ""tragic"". Dr Bari said authorities condemning the incident publicly was a positive sign that could lead to change. The arrested suspect is the son of a former public servant. He is from the town of Faisalabad, in the province of Punjab, according to police. Copyright 2025 BBC. All rights reserved.  The BBC is not responsible for the content of external sites. Read about our approach to external linking.  "
